{
  "$schema": "../../../../data/schema/npc.schema.json",
  "id": "test-fixture-npc-001",
  "type": "npc",
  "name": "TEST FIXTURE — Diagnostic NPC",
  "role": "Diagnostic Fixture",
  "pole": null,
  "affiliation": null,
  "namingPlaceholderRef": null,
  "openQuestionRefs": [],
  "status": "test fixture"
}
