{
  "$schema": "../schema/npc.schema.json",
  "id": "calibration-officer",
  "type": "npc",
  "name": null,
  "role": "Calibration Officer, The Calibration Hall",
  "pole": null,
  "affiliation": "directorate",
  "description": "Runs Resonance measurement sessions and signs the readings. The person who writes down, as an institutional fact, what a pilot can currently be trusted to do.",
  "designNotes": "Created 2026-09-12 with The Calibration Hall. Deliberately NOT given a position on whether anything in that building can reduce Bleed -- that is open-questions.json#bleed-recovery-sinks and Ingram's call. Name, manner, and how much discretion they have over a reading are all open.",
  "namingPlaceholderRef": null,
  "openQuestionRefs": [],
  "status": "placeholder — not yet named or cast"
}
